Title,index_image_url
"City God Temple in Haifeng County, Guangdong Province","https://bkimg.cdn.bcebos.com/pic/09fa513d269759ee5661eb33b8fb43166d22df11?x-bce-process=image/watermark,image_d2F0ZXIvYmFpa2UxNTA=,g_7,xp_5,yp_5/format,f_auto"
"City God Temple of Yangzhou, Jiangsu Province","https://bkimg.cdn.bcebos.com/pic/8601a18b87d6277fd532c3382f381f30e924fc8a?x-bce-process=image/watermark,image_d2F0ZXIvYmFpa2U4MA==,g_7,xp_5,yp_5/format,f_auto"
"City God Temple in Haicheng County, Fujian Province","https://bkimg.cdn.bcebos.com/pic/d50735fae6cd7b898701cece052442a7d9330e09?x-bce-process=image/watermark,image_d2F0ZXIvYmFpa2UxMTY=,g_7,xp_5,yp_5/format,f_auto"
"City God Temple in capital city, Fujian Province","https://bkimg.cdn.bcebos.com/pic/cb8065380cd79123d6db813fa4345982b2b78045?x-bce-process=image/resize,m_lfit,w_235,h_235,limit_1/format,f_auto"
"City God Temple of Jingjiang, Jiangsu Province","https://bkimg.cdn.bcebos.com/pic/cb8065380cd79123ea81463aab345982b2b7801f?x-bce-process=image/resize,m_lfit,w_220,h_220,limit_1/format,f_auto"
"City God Temple of Jieyang,  Guangdong Province ","https://bkimg.cdn.bcebos.com/pic/5243fbf2b21193133269290265380cd791238d5e?x-bce-process=image/resize,m_lfit,w_235,h_235,limit_1/format,f_auto"
"City God Temple of Guangzhou, Guangdong Province","https://bkimg.cdn.bcebos.com/pic/242dd42a2834349b6219b2e1c3ea15ce36d3beb3?x-bce-process=image/resize,m_lfit,w_220,limit_1/format,f_auto"
"City God Temple of Quanzhou, Fujian Province","https://bkimg.cdn.bcebos.com/pic/caef76094b36acaf184094b175d98d1000e99cde?x-bce-process=image/resize,m_lfit,w_220,h_220,limit_1/format,f_auto"
"Shiban City God Temple in Foshan, Guangdong Province","https://bkimg.cdn.bcebos.com/pic/f636afc379310a55d20b64babd4543a982261054?x-bce-process=image/resize,m_lfit,w_235,h_235,limit_1/format,f_auto"
"City God Temple of Zhaoan County, Fujian Province","https://bkimg.cdn.bcebos.com/pic/aa18972bd40735fae6cdbbea971a18b30f2442a7a207?x-bce-process=image/resize,m_lfit,w_440,limit_1/format,f_auto"
"City God Temple in Huangpu District, Shanghai Province",https://baike.baidu.com/pic/%E5%9F%8E%E9%9A%8D%E5%BA%99/2764713/0/7af40ad162d9f2d34cf21747acec8a136227ccb2?fr=lemma#aid=0&pic=7af40ad162d9f2d34cf21747acec8a136227ccb2
"City God Temple in Jiading County, Shanghai Province",https://baike.baidu.com/pic/%E5%98%89%E5%AE%9A%E5%9F%8E%E9%9A%8D%E5%BA%99/4551292/1/8c1001e93901213f5feceb0f52e736d12e2e9502?fr=lemma#aid=1&pic=8c1001e93901213f5feceb0f52e736d12e2e9502
"City God Temple of Xi'an, Shanxi Province",https://baike.baidu.com/pic/%E8%A5%BF%E5%AE%89%E9%83%BD%E5%9F%8E%E9%9A%8D%E5%BA%99/5732486/1/a1ec08fa513d26978719703552fbb2fb4216d894?fr=lemma&ct=single#aid=1753423122&pic=810a19d8bc3eb135823d7659af1ea8d3fc1f445e
"City God Temple of Hancheng, Shanxi Province",http://p7.itc.cn/images01/20200624/d9fcbdce3aab4829b04a595ee81dc937.jpeg
"Wugong City God Temple of Xianyang, Shanxi Province",https://baike.baidu.com/pic/%E6%AD%A6%E5%8A%9F%E5%9F%8E%E9%9A%8D%E5%BA%99/1443366/2216827488/962bd40735fae6cd1ecbe20f0db30f2442a70f64?fr=lemma#aid=2216827488&pic=962bd40735fae6cd1ecbe20f0db30f2442a70f64
"City God Temple in Sanyuan county, Shanxi Province",https://baike.baidu.com/pic/%E4%B8%89%E5%8E%9F%E5%9F%8E%E9%9A%8D%E5%BA%99/1468710/1250782509/9304c888decf37d9a5c2721a?fr=lemma&ct=cover#aid=1250782509&pic=9304c888decf37d9a5c2721a
"City God Temple of Ningbo, Zhejiang Province",https://baike.baidu.com/pic/%E5%9F%8E%E9%9A%8D%E5%BA%99/2764511/1844997386/8644ebf81a4c510fe02ddd7c6a59252dd52aa5ee?fr=lemma&ct=cover#aid=1844997386&pic=279759ee3d6d55fbaf4e4d4067224f4a21a4ddcf
"City God Temple of Zhengzhou, Henan Province",https://baike.baidu.com/pic/%E5%9F%8E%E9%9A%8D%E5%BA%99/2764585/0/9f2f070828381f30d32c61ddae014c086e06f089?fr=lemma&ct=single#aid=0&pic=9f2f070828381f30d32c61ddae014c086e06f089
Beijing Juyongguan Capital City God Temple,https://img.daoisms.org/allimg/130114/1-130114132335.jpg
Beijing City God Temple,"https://bkimg.cdn.bcebos.com/pic/c2cec3fdfc039245859aad248694a4c27d1e25e9?x-bce-process=image/watermark,image_d2F0ZXIvYmFpa2U5Mg==,g_7,xp_5,yp_5/format,f_auto"
"City God Temple in Lanzhou, Gansu Province","https://bkimg.cdn.bcebos.com/pic/4ec2d5628535e5dd54db5c7c7fc6a7efcf1b629a?x-bce-process=image/watermark,image_d2F0ZXIvYmFpa2UxNTA=,g_7,xp_5,yp_5/format,f_auto"
"Lintao City God Temple, Gansu",http://h.bytravel.cn/www/76/head/76103.gif
"City God Temple in Jinan, Shandong Province","https://bkimg.cdn.bcebos.com/pic/3bf33a87e950352a875804455943fbf2b2118b45?x-bce-process=image/watermark,image_d2F0ZXIvYmFpa2UxMTY=,g_7,xp_5,yp_5/format,f_auto"
"City God  Temple, Linyi City, Shandong Province",http://5b0988e595225.cdn.sohucs.com/images/20190219/9c0cf412fcd345798fe6c8af14bf15e9.jpeg
"City God  Temple, Gaizhou City, Liaoning Province",
"City God  Temple, Shuangta District, Chaoyang City, Liaoning Province",